{
    "name": "p5r",
    "description": "Slightly modified version of sub feeder within `P5R` region SMARTDS data from `SFO` area. Added PVsystem.",
    "contributor": "Kapil Duwadi",
    "contributed_date": "2024-12-03",
    "has_geo_coordinate": true,
    "has_time_series_data": true,
    "has_split_phase": true
}